{
  "protocol_version": 2,
  "evaluation_revision": "2.2",
  "change_id": "H06",
  "status": "draft",
  "category": "messaging",
  "query": "Assess this proposed change across the supplied repositories. Identify behavior that breaks, repositories needing production changes, validation-only obligations, directed contract dependencies, and a sufficient repair plan. Preserve the requested change and the stated compatibility requirements. Support findings with source evidence and state unresolved claims.",
  "snapshot_sha256": "fcb7d2471cb0756fb7eaf817c233522c9457861469eb7b68e87a826aebaaf4a8",
  "repository_universe": [
    "account-service",
    "basket-service",
    "catalog-service",
    "commerce-bff",
    "commerce-platform",
    "commerce-web",
    "inventory-service",
    "order-service",
    "payment-service",
    "shipment-service"
  ],
  "origin_repo": "order-service",
  "proposed_change": {
    "repo": "order-service",
    "diff": "--- a/src/main/java/com/poc/order/application/OrderService.java\n+++ b/src/main/java/com/poc/order/application/OrderService.java\n@@ -110,7 +110,7 @@\n         payload.put(\"items\", order.lines().stream()\n                 .map(line -> Map.<String, Object>of(\n                         \"productId\", line.productId().toString(),\n-                        \"quantity\", line.quantity()))\n+                        \"units\", line.quantity()))\n                 .toList());\n         return payload;\n     }\n"
  },
  "repositories": [
    {
      "repo": "order-service",
      "runtime_status": "unchanged"
    },
    {
      "repo": "inventory-service",
      "runtime_status": "broken"
    }
  ],
  "symbols": [
    {
      "repo": "inventory-service",
      "fqn": "com.poc.inventory.infrastructure.messaging.InventoryCommandListener.items"
    }
  ],
  "edges": [
    {
      "provider": "order-service",
      "consumer": "inventory-service",
      "type": "kafka",
      "identifier": "inventory.reserve.requested.v1",
      "field": "items[].quantity"
    }
  ],
  "repair_alternatives": [
    {
      "name": "preserve_requested_change_and_repair_consumers",
      "actions": [
        {
          "repo": "inventory-service",
          "target": "com.poc.inventory.infrastructure.messaging.InventoryCommandListener.items",
          "operation": "read_json_field",
          "before": "quantity",
          "after": "units",
          "critical": true
        }
      ],
      "obligations": [
        {
          "repo": "order-service",
          "obligation": "validation_only"
        },
        {
          "repo": "inventory-service",
          "obligation": "production_edit"
        }
      ]
    }
  ]
}
