{
  "protocol_version": 2,
  "evaluation_revision": "2.2",
  "change_id": "H04",
  "status": "verified",
  "category": "rest_contract",
  "query": "Assess this proposed change across the supplied repositories. Identify behavior that breaks, repositories needing production changes, validation-only obligations, directed contract dependencies, and a sufficient repair plan. Preserve the requested change and the stated compatibility requirements. Support findings with source evidence and state unresolved claims.",
  "snapshot_sha256": "fcb7d2471cb0756fb7eaf817c233522c9457861469eb7b68e87a826aebaaf4a8",
  "repository_universe": [
    "account-service",
    "basket-service",
    "catalog-service",
    "commerce-bff",
    "commerce-platform",
    "commerce-web",
    "inventory-service",
    "order-service",
    "payment-service",
    "shipment-service"
  ],
  "origin_repo": "catalog-service",
  "proposed_change": {
    "repo": "catalog-service",
    "diff": "--- a/src/main/java/com/poc/catalog/api/dto/ProductResponse.java\n+++ b/src/main/java/com/poc/catalog/api/dto/ProductResponse.java\n@@ -6,7 +6,7 @@\n         UUID id,\n         String name,\n         String description,\n-        String imageUrl,\n+        @com.fasterxml.jackson.annotation.JsonProperty(\"thumbnailUrl\") String imageUrl,\n         long priceMinor,\n         String currency,\n         boolean active\n"
  },
  "repositories": [
    {
      "repo": "catalog-service",
      "runtime_status": "unchanged"
    },
    {
      "repo": "basket-service",
      "runtime_status": "unchanged"
    },
    {
      "repo": "commerce-bff",
      "runtime_status": "unchanged"
    },
    {
      "repo": "commerce-web",
      "runtime_status": "broken"
    }
  ],
  "symbols": [
    {
      "repo": "commerce-web",
      "fqn": "src/pages/ProductsPage.tsx.ProductsPage"
    }
  ],
  "edges": [
    {
      "provider": "catalog-service",
      "consumer": "commerce-bff",
      "type": "rest",
      "identifier": "GET /api/v1/products",
      "field": "imageUrl"
    },
    {
      "provider": "commerce-bff",
      "consumer": "commerce-web",
      "type": "rest",
      "identifier": "GET /api/v1/products",
      "field": "imageUrl"
    }
  ],
  "repair_alternatives": [
    {
      "name": "preserve_requested_change_and_repair_consumers",
      "actions": [
        {
          "repo": "commerce-web",
          "target": "src/pages/ProductsPage.tsx.ProductsPage",
          "operation": "read_json_field",
          "before": "imageUrl",
          "after": "thumbnailUrl",
          "critical": true
        }
      ],
      "obligations": [
        {
          "repo": "catalog-service",
          "obligation": "validation_only"
        },
        {
          "repo": "basket-service",
          "obligation": "validation_only"
        },
        {
          "repo": "commerce-bff",
          "obligation": "validation_only"
        },
        {
          "repo": "commerce-web",
          "obligation": "production_edit"
        }
      ]
    }
  ]
}
